<?xml version="1.0"?>
<!DOCTYPE kb-response SYSTEM "kb_out.dtd">
<!--
  Warning on the empty Task C1-ABB-CSS-TASK
  Team: Individual learners
 -->
<kb-response>
  <inconsistent-slots>
  </inconsistent-slots>
  <missing-cards>
    <cards>
      <alternative>
        <position>C1-ABB-CSS-TASK</position>
      </alternative>
    </cards>
  </missing-cards>
  <suggested-cards>
    <cards>
      <ground-card>
        <team-card>INDIVIDUAL LEARNERS</team-card>
        <position>C2-ABA-CSS-TEAM</position>
      </ground-card>
    </cards>
  </suggested-cards>
</kb-response>