<?xml version="1.0"?>
<!DOCTYPE kb-response SYSTEM "kb_out.dtd">
<!--
  ERROR: Jigsaw – Phase II is needed
 -->
<kb-response>
  <inconsistent-slots>
     <position>C1-CSW-TECHNIQUE</position>
     <position>C2-CSW-TECHNIQUE</position>
  </inconsistent-slots>
  <missing-cards>
    <cards>
    </cards>
  </missing-cards>
  <suggested-cards>
    <cards>
    </cards>
  </suggested-cards>
</kb-response>