<?xml version="1.0"?>
<!DOCTYPE kb-response SYSTEM "kb_out.dtd">
<!--
  Selected study materials 
-->
<kb-response>
  <inconsistent-slots>
  </inconsistent-slots>
  <missing-cards>
    <cards>
    </cards>
  </missing-cards>
  <suggested-cards>
    <cards>
      <ground-card>
        <technology-card>SELECTED STUDY MATERIALS</technology-card>
      </ground-card>
      <position>C1-ABA-CSS-TEC1</position>
    </cards>
  </suggested-cards>
</kb-response>