<?xml version="1.0"?>
<!DOCTYPE kb-response SYSTEM "kb_out.dtd">
<!--
  Discussion phase i all cases
 -->
<kb-response>
  <inconsistent-slots>
  </inconsistent-slots>
  <missing-cards>
    <cards>
    </cards>
  </missing-cards>
  <suggested-cards>
    <cards>
      <ground-card>
        <technique-card>DISCUSSION - PHASE I (ALL CASES)</technique-card>
        <position>C1-CSW-TECHNIQUE</position>
      </ground-card>
    </cards>
  </suggested-cards>
</kb-response>