<?xml version="1.0"?>
<!DOCTYPE kb-response SYSTEM "kb_out.dtd">
<!--
  Warning on the empty Task C1-ABA-CSS-TASK
  Phase II:  Discussion towards assignment or Discussion towards artefatc or Discussion towards report
 -->
<kb-response>
  <inconsistent-slots>
  </inconsistent-slots>
  <missing-cards>
    <cards>
      <alternative>
         <position>C1-ABA-CSS-TASK</position>
     </alternative>
    </cards>
  </missing-cards>
  <suggested-cards>
    <cards>
      <alternative>
        <technique-card>DISCUSSION (TOWARDS ASSIGNMENT) - PHASE II</technique-card>
        <technique-card>DISCUSSION (TOWARDS ARTEFACT) - PHASE II</technique-card>
        <technique-card>DISCUSSION (TOWARDS REPORT) - PHASE II</technique-card>
        <position>C2-CSW-TECHNIQUE</position>
      </alternative>
    </cards>
  </suggested-cards>
</kb-response>