<?xml version="1.0"?>
<!DOCTYPE kb-response SYSTEM "kb_out.dtd">
<!--
  Warning on the empty Task C1-ABA-CSS-TASK
  Technique: empty cell
 -->
<kb-response>
  <inconsistent-slots>
  </inconsistent-slots>
  <missing-cards>
    <cards>
      <alternative>
        <position>C1-ABA-CSS-TASK</position>
      </alternative>
    </cards>
  </missing-cards>
  <suggested-cards>
    <cards>
      <ground-card>
        <technique-card />
        <position>C2-CSW-TECHNIQUE</position>
      </ground-card>
    </cards>
  </suggested-cards>
</kb-response>